<?xml version="1.0"?>
<!-- Copyright (C) 2019-2021 Free Software Foundation, Inc.

     Copying and distribution of this file, with or without modification,
     are permitted in any medium without royalty provided the copyright
     notice and this notice are preserved.  -->

<!DOCTYPE feature SYSTEM "gdb-target.dtd">
<feature name="org.gnu.gdb.intelgt.grf">

  <reg name="r0" bitsize="256" type="uint256"/>
  <reg name="r1" bitsize="256" type="uint256"/>
  <reg name="r2" bitsize="256" type="uint256"/>
  <reg name="r3" bitsize="256" type="uint256"/>
  <reg name="r4" bitsize="256" type="uint256"/>
  <reg name="r5" bitsize="256" type="uint256"/>
  <reg name="r6" bitsize="256" type="uint256"/>
  <reg name="r7" bitsize="256" type="uint256"/>
  <reg name="r8" bitsize="256" type="uint256"/>
  <reg name="r9" bitsize="256" type="uint256"/>
  <reg name="r10" bitsize="256" type="uint256"/>
  <reg name="r11" bitsize="256" type="uint256"/>
  <reg name="r12" bitsize="256" type="uint256"/>
  <reg name="r13" bitsize="256" type="uint256"/>
  <reg name="r14" bitsize="256" type="uint256"/>
  <reg name="r15" bitsize="256" type="uint256"/>
  <reg name="r16" bitsize="256" type="uint256"/>
  <reg name="r17" bitsize="256" type="uint256"/>
  <reg name="r18" bitsize="256" type="uint256"/>
  <reg name="r19" bitsize="256" type="uint256"/>
  <reg name="r20" bitsize="256" type="uint256"/>
  <reg name="r21" bitsize="256" type="uint256"/>
  <reg name="r22" bitsize="256" type="uint256"/>
  <reg name="r23" bitsize="256" type="uint256"/>
  <reg name="r24" bitsize="256" type="uint256"/>
  <reg name="r25" bitsize="256" type="uint256"/>
  <reg name="r26" bitsize="256" type="uint256"/>
  <reg name="r27" bitsize="256" type="uint256"/>
  <reg name="r28" bitsize="256" type="uint256"/>
  <reg name="r29" bitsize="256" type="uint256"/>
  <reg name="r30" bitsize="256" type="uint256"/>
  <reg name="r31" bitsize="256" type="uint256"/>
  <reg name="r32" bitsize="256" type="uint256"/>
  <reg name="r33" bitsize="256" type="uint256"/>
  <reg name="r34" bitsize="256" type="uint256"/>
  <reg name="r35" bitsize="256" type="uint256"/>
  <reg name="r36" bitsize="256" type="uint256"/>
  <reg name="r37" bitsize="256" type="uint256"/>
  <reg name="r38" bitsize="256" type="uint256"/>
  <reg name="r39" bitsize="256" type="uint256"/>
  <reg name="r40" bitsize="256" type="uint256"/>
  <reg name="r41" bitsize="256" type="uint256"/>
  <reg name="r42" bitsize="256" type="uint256"/>
  <reg name="r43" bitsize="256" type="uint256"/>
  <reg name="r44" bitsize="256" type="uint256"/>
  <reg name="r45" bitsize="256" type="uint256"/>
  <reg name="r46" bitsize="256" type="uint256"/>
  <reg name="r47" bitsize="256" type="uint256"/>
  <reg name="r48" bitsize="256" type="uint256"/>
  <reg name="r49" bitsize="256" type="uint256"/>
  <reg name="r50" bitsize="256" type="uint256"/>
  <reg name="r51" bitsize="256" type="uint256"/>
  <reg name="r52" bitsize="256" type="uint256"/>
  <reg name="r53" bitsize="256" type="uint256"/>
  <reg name="r54" bitsize="256" type="uint256"/>
  <reg name="r55" bitsize="256" type="uint256"/>
  <reg name="r56" bitsize="256" type="uint256"/>
  <reg name="r57" bitsize="256" type="uint256"/>
  <reg name="r58" bitsize="256" type="uint256"/>
  <reg name="r59" bitsize="256" type="uint256"/>
  <reg name="r60" bitsize="256" type="uint256"/>
  <reg name="r61" bitsize="256" type="uint256"/>
  <reg name="r62" bitsize="256" type="uint256"/>
  <reg name="r63" bitsize="256" type="uint256"/>
  <reg name="r64" bitsize="256" type="uint256"/>
  <reg name="r65" bitsize="256" type="uint256"/>
  <reg name="r66" bitsize="256" type="uint256"/>
  <reg name="r67" bitsize="256" type="uint256"/>
  <reg name="r68" bitsize="256" type="uint256"/>
  <reg name="r69" bitsize="256" type="uint256"/>
  <reg name="r70" bitsize="256" type="uint256"/>
  <reg name="r71" bitsize="256" type="uint256"/>
  <reg name="r72" bitsize="256" type="uint256"/>
  <reg name="r73" bitsize="256" type="uint256"/>
  <reg name="r74" bitsize="256" type="uint256"/>
  <reg name="r75" bitsize="256" type="uint256"/>
  <reg name="r76" bitsize="256" type="uint256"/>
  <reg name="r77" bitsize="256" type="uint256"/>
  <reg name="r78" bitsize="256" type="uint256"/>
  <reg name="r79" bitsize="256" type="uint256"/>
  <reg name="r80" bitsize="256" type="uint256"/>
  <reg name="r81" bitsize="256" type="uint256"/>
  <reg name="r82" bitsize="256" type="uint256"/>
  <reg name="r83" bitsize="256" type="uint256"/>
  <reg name="r84" bitsize="256" type="uint256"/>
  <reg name="r85" bitsize="256" type="uint256"/>
  <reg name="r86" bitsize="256" type="uint256"/>
  <reg name="r87" bitsize="256" type="uint256"/>
  <reg name="r88" bitsize="256" type="uint256"/>
  <reg name="r89" bitsize="256" type="uint256"/>
  <reg name="r90" bitsize="256" type="uint256"/>
  <reg name="r91" bitsize="256" type="uint256"/>
  <reg name="r92" bitsize="256" type="uint256"/>
  <reg name="r93" bitsize="256" type="uint256"/>
  <reg name="r94" bitsize="256" type="uint256"/>
  <reg name="r95" bitsize="256" type="uint256"/>
  <reg name="r96" bitsize="256" type="uint256"/>
  <reg name="r97" bitsize="256" type="uint256"/>
  <reg name="r98" bitsize="256" type="uint256"/>
  <reg name="r99" bitsize="256" type="uint256"/>
  <reg name="r100" bitsize="256" type="uint256"/>
  <reg name="r101" bitsize="256" type="uint256"/>
  <reg name="r102" bitsize="256" type="uint256"/>
  <reg name="r103" bitsize="256" type="uint256"/>
  <reg name="r104" bitsize="256" type="uint256"/>
  <reg name="r105" bitsize="256" type="uint256"/>
  <reg name="r106" bitsize="256" type="uint256"/>
  <reg name="r107" bitsize="256" type="uint256"/>
  <reg name="r108" bitsize="256" type="uint256"/>
  <reg name="r109" bitsize="256" type="uint256"/>
  <reg name="r110" bitsize="256" type="uint256"/>
  <reg name="r111" bitsize="256" type="uint256"/>
  <reg name="r112" bitsize="256" type="uint256"/>
  <reg name="r113" bitsize="256" type="uint256"/>
  <reg name="r114" bitsize="256" type="uint256"/>
  <reg name="r115" bitsize="256" type="uint256"/>
  <reg name="r116" bitsize="256" type="uint256"/>
  <reg name="r117" bitsize="256" type="uint256"/>
  <reg name="r118" bitsize="256" type="uint256"/>
  <reg name="r119" bitsize="256" type="uint256"/>
  <reg name="r120" bitsize="256" type="uint256"/>
  <reg name="r121" bitsize="256" type="uint256"/>
  <reg name="r122" bitsize="256" type="uint256"/>
  <reg name="r123" bitsize="256" type="uint256"/>
  <reg name="r124" bitsize="256" type="uint256"/>
  <reg name="r125" bitsize="256" type="uint256"/>
  <reg name="r126" bitsize="256" type="uint256"/>
  <reg name="r127" bitsize="256" type="uint256"/>

</feature>
