<?xml version="1.0"?>
<!-- Copyright (C) 2020-2022 Free Software Foundation, Inc.
   Copyright (C) 2025-2026 Intel Corporation

     Copying and distribution of this file, with or without modification,
     are permitted in any medium without royalty provided the copyright
     notice and this notice are preserved.  -->

<!DOCTYPE feature SYSTEM "gdb-target.dtd">
<feature name="org.gnu.gdb.i386.amx">
  <vector id="v_i8" type="int8" count="64"/>
  <vector id="matrix_i8" type="v_i8" count="128"/>

  <vector id="v_ui8" type="uint8" count="64"/>
  <vector id="matrix_ui8" type="v_ui8" count="128"/>

  <vector id="v_i32" type="int32" count="16"/>
  <vector id="matrix_i32" type="v_i32" count="128"/>

  <vector id="v_bf16" type="bfloat16" count="32"/>
  <vector id="matrix_bf16" type="v_bf16" count="128"/>

  <vector id="v_fp16" type="ieee_half" count="32"/>
  <vector id="matrix_fp16" type="v_fp16" count="128"/>

  <vector id="v_fp32" type="ieee_single" count="16"/>
  <vector id="matrix_fp32" type="v_fp32" count="128"/>

  <union id="tiledata_type">
    <field name="m_int8" type="matrix_i8"/>
    <field name="m_uint8" type="matrix_ui8"/>
    <field name="m_int32" type="matrix_i32"/>
    <field name="m_bf16" type="matrix_bf16"/>
    <field name="m_fp16" type="matrix_fp16"/>
    <field name="m_fp32" type="matrix_fp32"/>
  </union>

  <!-- For tilecfg_raw, we choose an arbitrary type that has the size
       of 512 bits.  -->
  <reg name="tilecfg_raw" bitsize="512" type="v_i8"/>

  <reg name="tiledata" bitsize="65536" type="tiledata_type"/>
</feature>
